{
  "schema_version": 1,
  "idea_id": "idea_0beeab7573d3f58b0330",
  "identity": {
    "problem_key": "generated_kernel_deployment_gap",
    "mechanism_key": "hardware_aware_closed_loop_optimization",
    "target_key": "gpu_and_npu_kernels"
  },
  "idea_type": "solution_concept",
  "title": "把硬件知识与真实部署验收接成内核优化闭环",
  "problem": "自动生成的加速器内核常在语法或离线基准上通过，却无法稳定达到真实设备和部署环境的性能要求。",
  "hypothesis": "将设备约束检索、候选生成、编译运行和部署内验收闭环，可提高可用内核比例并减少纸面加速。",
  "mechanism": "按目标 GPU 或 NPU 注入硬件知识，生成多个候选，以真实编译器、设备计数器和服务负载反馈迭代。",
  "expected_effect": "提高编译成功率和部署内加速命中率，同时控制回归与搜索成本。",
  "topic_ids": [
    "ai_chip_accelerator"
  ],
  "status": "observing",
  "evidence_for": [
    {
      "item_id": "f682b45f4e2f6eed337331d3",
      "issue_date": "2026-08-10",
      "source_urls": [
        "https://arxiv.org/abs/2608.05033v1"
      ],
      "reason": "《SparseDitto自动生成GPU稀疏内核》为该候选的问题、机制或边界提供已发布依据。"
    },
    {
      "item_id": "a58adb4322d178c37bfe538a",
      "issue_date": "2026-08-11",
      "source_urls": [
        "https://arxiv.org/abs/2607.01590v2"
      ],
      "reason": "《Hawk：硬件感知知识把昇腾NPU内核生成成功率从49%拉到80%》为该候选的问题、机制或边界提供已发布依据。"
    },
    {
      "item_id": "56669f597b366c481995590f",
      "issue_date": "2026-08-29",
      "source_urls": [
        "https://arxiv.org/abs/2608.21836v1"
      ],
      "reason": "《LLM4LLM：闭环Agentic内核优化对齐真实部署》为该候选的问题、机制或边界提供已发布依据。"
    },
    {
      "item_id": "44400d42b94dcdd8ce303fa3",
      "issue_date": "2026-09-16",
      "source_urls": [
        "https://arxiv.org/abs/2607.20120v1"
      ],
      "reason": "该工作在三代 Ascend 上实测五类科学负载，归纳 Cube 与内存层级映射范式并给出带宽与内核级瓶颈数据（910C hgemm 每 die 324 TFLOPS、量子模拟门融合可翻倍）；直接提供硬件知识与真实部署验收闭环所需的一手内核瓶颈证据，但优化依赖 CANN 版本与手工 kernel。"
    },
    {
      "item_id": "72de14279336dcc58b59c611",
      "issue_date": "2026-09-18",
      "source_urls": [
        "https://arxiv.org/abs/2608.10103v1"
      ],
      "reason": "PTX 对照研究给出手写内核的精度判据：INT4 原生指令收益最大、INT8 次之、FP16 因操作数打包开销持平；直接支持按硬件知识与精度档位决定内核投入的闭环判断（单卡 L4、仅方阵形状）。"
    },
    {
      "item_id": "ca8a845fb43a44f6857582a0",
      "issue_date": "2026-09-18",
      "source_urls": [
        "https://arxiv.org/abs/2608.26575v1"
      ],
      "reason": "Blackwell 机密计算的真实代价测量把 stock 栈 30-40% 开销归因为可避免配置、正确配置仅 1-3%；为部署验收提供先校准配置再下结论的实测范例（跨节点 RDMA 与 attestation 未量化）。"
    },
    {
      "item_id": "d5af35f37ab3b07e48d69a93",
      "issue_date": "2026-09-20",
      "source_urls": [
        "https://arxiv.org/abs/2608.25096v1"
      ],
      "reason": "跨四模型实测给出注意力架构与 decode 能耗缩放的判据（MHA 增 17 至 18%、GQA 仅 3 至 4%、SWA 消除序列内漂移）；为按硬件实测知识选择模型与内核投入提供部署侧依据（仅四模型、decode 相位、两因素未完全解耦）。"
    },
    {
      "item_id": "553537e4cdf72815498f5933",
      "issue_date": "2026-09-28",
      "source_urls": [
        "https://arxiv.org/abs/2609.21264v1"
      ],
      "reason": "XDNA 2 编程判据把设备约束知识变成可操作的融合决策规则：三阶段全融合到越过 ridge point 即止，FlashAttention 达 3.62 TFLOP/s、能效为集成 GPU 的 5.3-7.2 倍；为硬件约束检索进入内核优化闭环提供跨代可复算的判据实例（XDNA 1 上同一融合几乎无益，外推需重算 ridge point）。"
    },
    {
      "item_id": "e5785b0bcab7b8d1970ac9ba",
      "issue_date": "2026-09-30",
      "source_urls": [
        "https://arxiv.org/abs/2609.36070v1"
      ],
      "reason": "Mixture-of-Kittens 证明不注入 NVL72 单跳域互连假设的内核会输给 PyTorch+NCCL 基线，按域重设计巨型内核后最高加速 2.37 倍、生产栈每 GPU 吞吐从 761 升到 1070 token/s；为设备约束知识进入内核优化闭环提供 scale-up 域的反例与正例对照（结果绑定 NVL72 体制与特定模型形状）。"
    },
    {
      "item_id": "7f438d57ec9dea1e020136fe",
      "issue_date": "2026-10-12",
      "source_urls": [
        "https://arxiv.org/abs/2609.35568v1"
      ],
      "reason": "SAGE 在公开代码稀缺的 Ascend NPU 上用外部持久记忆跨 88 算子积累硬件特定 kernel 知识，执行率 95.5% 对受控基线 84.1%、中位加速 1.54 倍；把设备约束知识检索变成可持续演化的记忆资产，直接支撑该 Idea 的知识积累侧（收益强依赖 backbone、不覆盖长程合成）。"
    }
  ],
  "evidence_against": [],
  "unknowns": [
    "跨设备硬件知识能否复用",
    "真实服务验收所需的最小流量和计数器集合"
  ],
  "validation_plan": {
    "mode": "prototype",
    "minimal_model": "在一组 GPU 与 NPU 算子上运行知识增强生成、编译、设备基准和服务回放闭环。",
    "inputs": [
      "代表性算子集",
      "目标设备约束",
      "真实请求回放"
    ],
    "baselines": [
      "无硬件知识的单轮生成",
      "仅离线微基准选择"
    ],
    "metrics": [
      "编译成功率",
      "部署内加速命中率",
      "性能回归率",
      "搜索成本"
    ],
    "support_criteria": [
      "成功率与部署收益同时提升且回归可控"
    ],
    "reject_criteria": [
      "离线收益无法在服务回放中复现"
    ],
    "limitations": [
      "首版只覆盖少量设备和算子类别"
    ],
    "execution_status": "suggestion_only"
  },
  "first_seen_issue": "2026-08-10",
  "last_updated_issue": "2026-10-12",
  "decision_log": [
    {
      "event_id": "idea_decision_bd6ef4f8e56095302a86",
      "issue_date": "2026-09-03",
      "decision": "created",
      "from_status": null,
      "to_status": "observing",
      "reason": "Candidate candidate_0beeab7573d3f58b0330 通过身份、来源独立性和可验证性审阅后进入正式 Idea。",
      "evidence_item_ids": [
        "f682b45f4e2f6eed337331d3",
        "a58adb4322d178c37bfe538a",
        "56669f597b366c481995590f"
      ]
    },
    {
      "event_id": "idea_decision_d53fac9025ff60e31e2",
      "issue_date": "2026-09-16",
      "decision": "evidence_added",
      "from_status": "observing",
      "to_status": "observing",
      "reason": "新增已发布证据提供三代国产 NPU 的系统级实测基线，继续支持硬件知识与真实部署验收闭环；Idea 状态暂不改变。",
      "evidence_item_ids": [
        "44400d42b94dcdd8ce303fa3"
      ]
    },
    {
      "event_id": "idea_decision_6dab6610d2459c8e32d",
      "issue_date": "2026-09-18",
      "decision": "evidence_added",
      "from_status": "observing",
      "to_status": "observing",
      "reason": "新增已发布证据从内核精度判据与部署配置校准两侧支持硬件知识与真实部署验收闭环；Idea 状态暂不改变。",
      "evidence_item_ids": [
        "72de14279336dcc58b59c611",
        "ca8a845fb43a44f6857582a0"
      ]
    },
    {
      "event_id": "idea_decision_135b73c6861f9289e3f",
      "issue_date": "2026-09-20",
      "decision": "evidence_added",
      "from_status": "observing",
      "to_status": "observing",
      "reason": "新增已发布证据以能耗实测判据继续支持硬件知识与部署验收闭环；Idea 状态暂不改变。",
      "evidence_item_ids": [
        "d5af35f37ab3b07e48d69a93"
      ]
    },
    {
      "event_id": "idea_decision_94656460de1d1067df8",
      "issue_date": "2026-09-28",
      "decision": "evidence_added",
      "from_status": "observing",
      "to_status": "observing",
      "reason": "新增已发布证据给出硬件约束判据驱动内核决策的实测实例；Idea状态暂不改变。",
      "evidence_item_ids": [
        "553537e4cdf72815498f5933"
      ]
    },
    {
      "event_id": "idea_decision_423ac7f4d73271f160e",
      "issue_date": "2026-09-30",
      "decision": "evidence_added",
      "from_status": "observing",
      "to_status": "observing",
      "reason": "新增已发布证据给出scale-up域内核假设的直接对照实例；Idea状态暂不改变。",
      "evidence_item_ids": [
        "e5785b0bcab7b8d1970ac9ba"
      ]
    },
    {
      "event_id": "idea_decision_f2286a8f51467993a79",
      "issue_date": "2026-10-12",
      "decision": "evidence_added",
      "from_status": "observing",
      "to_status": "observing",
      "reason": "新增已发布证据给出硬件知识持久记忆化的NPU实例；Idea状态暂不改变。",
      "evidence_item_ids": [
        "7f438d57ec9dea1e020136fe"
      ]
    }
  ]
}